<?xml version="1.0" encoding="utf-8"?>
<xs:schema targetNamespace="https://stagelab.coop/cuems/" xmlns:xs="http://www.w3.org/2001/XMLSchema" xmlns:cms="https://stagelab.coop/cuems/">
    <xs:element name="CuemsNetworkMap">
            <xs:annotation>
                <xs:documentation xml:lang="en">Cluster topology, discovered. Two writers at element granularity (F1, feature 011): cuems-nodeconf owns every other node's row and the adopted/online flags; cuems-init-node seeds this node's own row by plain insert at provisioning.</xs:documentation>
                <xs:appinfo>
                    <cms:writer scope="topology">cuems-nodeconf</cms:writer>
                    <cms:writer scope="self-entry">cuems-init-node</cms:writer>
                </xs:appinfo>
            </xs:annotation>
        <xs:complexType>
            <xs:sequence>
                <xs:element name="node_list" minOccurs="0" maxOccurs="1" type="cms:NodeDictType" />
            </xs:sequence>
            <!-- Document-property version marker (feature 008, ITEM E, FR-048a).
                 Not a domain field: excluded from spec._derive_attributes and
                 every wire projection (research R1). Absent means version 1
                 (FR-050); this schema stays at version 1 (FR-048b). -->
            <xs:attribute name="doc_version" type="xs:positiveInteger" use="optional" />
        </xs:complexType>
    </xs:element>

    <xs:complexType name="NodeDictType">
        <xs:sequence>
            <xs:element name="node" minOccurs="0" maxOccurs="unbounded" type="cms:NodeType" />
        </xs:sequence>
    </xs:complexType>

    <xs:complexType name="NodeType">
        <xs:sequence>
            <xs:element name="uuid" minOccurs="1" maxOccurs="1" type="cms:UuidType"/>
            <xs:element name="mac" minOccurs="1" maxOccurs="1" type="cms:NonEmptyString"/>
            <xs:element name="name" minOccurs="1" maxOccurs="1" type="cms:NonEmptyString"/>
            <xs:element name="node_role" minOccurs="1" maxOccurs="1" type="cms:NodeRoleType"/>
            <xs:element name="ip" minOccurs="1" maxOccurs="1" type="cms:NonEmptyString"/>
            <xs:element name="adopted" minOccurs="0" maxOccurs="1" type="cms:BoolType"/>
            <xs:element name="online" minOccurs="0" maxOccurs="1" type="cms:BoolType"/>
            <!-- Optional identity fields (feat/node-identity). nodeconf assigns
                 role_id during adoption; alias is operator-defined; hostname
                 is transitional (only set for legacy nodes whose OS hostname
                 differs from role_id). See cuems-common docs/node-identity-contract.md. -->
            <xs:element name="role_id" minOccurs="0" maxOccurs="1" type="cms:NonEmptyString"/>
            <xs:element name="alias" minOccurs="0" maxOccurs="1" type="cms:NonEmptyString"/>
            <xs:element name="hostname" minOccurs="0" maxOccurs="1" type="xs:string"/>
        </xs:sequence>
    </xs:complexType>

    <xs:simpleType name="NonEmptyString">
        <xs:restriction base="xs:string">
            <xs:minLength value="1" />
            <xs:pattern value=".*[^\s].*" />
        </xs:restriction>
    </xs:simpleType>

    <xs:simpleType name="BoolType">
        <xs:restriction base="xs:string">
            <xs:enumeration value="True" />
            <xs:enumeration value="False" />
        </xs:restriction>
    </xs:simpleType>

    <!-- feature 007: node_type (free text) -> node_role (real enumeration).
         controller/node/firstrun replace master/slave/firstrun. -->
    <xs:simpleType name="NodeRoleType">
        <xs:restriction base="xs:string">
            <xs:enumeration value="controller" />
            <xs:enumeration value="node" />
            <xs:enumeration value="firstrun" />
        </xs:restriction>
    </xs:simpleType>

    <!-- feature 007: shape only (canonical 8-4-4-4-12 hex), not uuid4 semantics
         — an unparseable value still loads, kept as raw text (research R2). -->
    <xs:simpleType name="UuidType">
        <xs:restriction base="xs:string">
            <xs:pattern value="[0-9a-fA-F]{8}-[0-9a-fA-F]{4}-[0-9a-fA-F]{4}-[0-9a-fA-F]{4}-[0-9a-fA-F]{12}" />
        </xs:restriction>
    </xs:simpleType>
</xs:schema>